{
  "$schema": "./budgets.schema.json",
  "lines": {
    "hookFile": 150,
    "hooksTotal": 1500,
    "libFile": 300,
    "orchestrator": 150,
    "stageSkill": 200,
    "agentsMd": 60,
    "agent": 80,
    "packageScript": 150
  },
  "context": {
    "alwaysLoadedTokens": 8000,
    "bytesPerToken": 3
  },
  "timing": {
    "recordP95Ms": 200,
    "checkP95Ms": 2000,
    "samples": 20,
    "testTimeoutMs": 5000,
    "testFileTimeoutMs": 90000,
    "checkTimeoutMs": {
      "default": 90000,
      "win32": 150000
    }
  },
  "coverage": {
    "lib": {
      "lines": 95,
      "branches": 95,
      "functions": 100
    },
    "hooks": {
      "lines": 90,
      "branches": 85
    }
  },
  "mutation": {
    "score": 80
  }
}
